{
  "vector_id": "V0005",
  "description": "Symmetry restored, zero warp, zero error â€” TRUE case.",
  "initial_phase_state": [
    [0,0,0],[0,0,0],[0,0,0],[0,0,0],
    [0,0,0],[0,0,0],[0,0,0],[0,0,0],
    [0,0,0],[0,0,0],[0,0,0],[0,0,0],
    [0,0,0],[0,0,0],[0,0,0],[0,0,0]
  ],
  "plugins": {
    "alpha": {
      "id": "alpha",
      "domain": "Refraction",
      "warp_vector": [0,0,0],
      "error": 0,
      "version": "1.0.0",
      "status": "OK"
    },
    "beta": {
      "id": "beta",
      "domain": "FrameDrag",
      "warp_vector": [0,0,0],
      "error": 0,
      "version": "1.0.0",
      "status": "OK"
    },
    "gamma": {
      "id": "gamma",
      "domain": "Jitter",
      "warp_vector": [0,0,0],
      "error": 0,
      "version": "1.0.0",
      "status": "OK"
    }
  }
}